{
  "product_id": "杯子_20260812_013323",
  "artifact_type": "set_angle_layout_inventory",
  "user_declared_set_product": true,
  "set_group_assets": [
    {
      "asset_id": "set_group_001",
      "file_path": "1S0A1884.JPG"
    },
    {
      "asset_id": "set_group_002",
      "file_path": "1S0A1887.JPG"
    },
    {
      "asset_id": "set_group_003",
      "file_path": "1S0A1888.JPG"
    }
  ],
  "layouts": [
    {
      "layout_id": "layout_001",
      "image_index": 1,
      "file_name": "1S0A1884.JPG",
      "is_set_group": true,
      "overall_camera": "B",
      "camera_decision_basis": "相机位于套装斜前方并略高于桌面，可同时看到杯口内侧、杯碟上表面和各单件之间的前后空间关系，最接近 45°斜侧机位。",
      "layout_slot": "编排槽位三",
      "layout_decision_basis": "5 个杯碟组合分布在前后左右不同位置，前排、中央和后排形成明显纵深层次，彼此不作上下叠放，最接近阶梯纵深。",
      "piece_count_check": "画面中可见 5 个杯碟组成单件，与套装产品身份档案锁定的 5 件一致。",
      "component_visibility": "5 个组成单件均可识别，杯体与杯碟关系基本清楚；后方浅蓝白单件距离较远但仍可见，未出现严重裁切。",
      "naturally_visible_content": "适合展示套装 5 件数量、不同釉色对比、同批次组合关系、前后层次和桌面陈列秩序。",
      "must_not_force_content": "不应强行展示各单件底部、背面、底款、精确高度差或真实尺寸信息。",
      "suitable_page_tasks": "适合承担套装主图、套装整体展示图、五件并列关系说明和成套视觉对比任务。",
      "unsuitable_page_tasks": "不适合承担单件底部结构、容量尺寸、包装清单或某一单件细节特写任务。",
      "main_image_suitability": "适合，因为 5 件齐全、件距较清楚，能表达套装整体第一印象。",
      "detail_image_suitability": "适合，因为可用于说明套装件数、釉色差异和整体陈列关系。",
      "risk_notes": "后方浅蓝白单件较远且细节弱于前排，存在轻微视觉权重不均风险。",
      "recommended_task_binding": "建议绑定套装主图或套装整体陈列关系展示任务。",
      "admission_result": "合格，可进入对应机位与编排槽位",
      "merged_reference_note": "无"
    },
    {
      "layout_id": "layout_002",
      "image_index": 2,
      "file_name": "1S0A1887.JPG",
      "is_set_group": true,
      "overall_camera": "B",
      "camera_decision_basis": "相机位于斜前方并略高，可看到杯口、杯碟上表面和左右两组层叠关系，最接近 45°斜侧机位。",
      "layout_slot": "编排槽位二",
      "layout_decision_basis": "左右两侧均出现杯体与杯碟的上下层叠，中间单件独立后置，核心编排特征是局部叠放承托，最接近主从层叠。",
      "piece_count_check": "画面中可见 5 个杯碟组成单件，与套装产品身份档案锁定的 5 件一致。",
      "component_visibility": "5 个组成单件均可识别，但左右两组存在明显层叠，部分杯碟边缘、杯体下部和被承托关系被遮挡。",
      "naturally_visible_content": "适合展示套装组合层次、局部叠放关系、5 件同批次组合和立体陈列感。",
      "must_not_force_content": "不应强行展示被遮挡单件的底部结构、完整杯碟边缘、背面细节或精确尺寸关系。",
      "suitable_page_tasks": "适合承担套装详情图中的层叠编排说明、组合关系展示和立体陈列展示任务。",
      "unsuitable_page_tasks": "不适合承担需要逐件完整无遮挡核对的主规格图、单件结构拆解图或尺寸标注图。",
      "main_image_suitability": "勉强适合，因为件数可核对但层叠遮挡较明显，部分单件完整性弱于并列陈列。",
      "detail_image_suitability": "适合，因为层叠关系清楚，适合说明套装组合和陈列层次。",
      "risk_notes": "存在件间遮挡和杯碟重叠风险，左右两组层叠可能导致部分单件结构不可完整识别。",
      "recommended_task_binding": "建议绑定套装层叠陈列、组合关系或详情图中的空间层次展示任务。",
      "admission_result": "合格，可进入对应机位与编排槽位",
      "merged_reference_note": "无"
    },
    {
      "layout_id": "layout_003",
      "image_index": 3,
      "file_name": "1S0A1888.JPG",
      "is_set_group": true,
      "overall_camera": "B",
      "camera_decision_basis": "相机从斜前方略高位置拍摄，可见杯口、杯碟上表面、侧向杯柄和前后层次，最接近 45°斜侧机位。",
      "layout_slot": "编排槽位二",
      "layout_decision_basis": "左右两侧存在明显上下叠放，中间浅蓝白杯体侧放在杯碟上，核心关系为杯体与杯碟或杯体之间的局部层叠，最接近主从层叠。",
      "piece_count_check": "画面中可见 5 个杯碟组成单件，与套装产品身份档案锁定的 5 件一致。",
      "component_visibility": "5 个组成单件均可识别，但左侧和右侧的层叠遮挡较明显，中间浅蓝白杯体侧放导致常规正面结构不完整。",
      "naturally_visible_content": "适合展示套装层叠编排、局部使用式摆放、立体层次和 5 件同批次组合关系。",
      "must_not_force_content": "不应强行展示侧放杯体的正常正面完整结构、被遮挡杯碟底部、底款、背面或精确高度关系。",
      "suitable_page_tasks": "适合承担套装详情图中的层叠关系、组合变化和空间陈列展示任务。",
      "unsuitable_page_tasks": "不适合承担标准主图、逐件无遮挡核对、单件结构完整展示或尺寸标注任务。",
      "main_image_suitability": "勉强适合，因为件数可核对但侧放和层叠会削弱标准主图的完整、稳定展示。",
      "detail_image_suitability": "适合，因为可用于说明套装局部层叠和组合陈列关系。",
      "risk_notes": "存在件间遮挡、杯碟重叠和中间单件侧放导致结构可见性不足的风险。",
      "recommended_task_binding": "建议绑定套装层叠陈列详情、组合关系说明或非首张主图的变化展示任务。",
      "admission_result": "合格，可进入对应机位与编排槽位",
      "merged_reference_note": "无"
    },
    {
      "layout_id": "layout_004",
      "image_index": 4,
      "file_name": "1S0A1890.JPG",
      "is_set_group": false,
      "overall_camera": "A",
      "camera_decision_basis": "单件从接近正面且略高的位置拍摄，可见杯口内侧、杯身正面纹理、杯柄和杯碟上表面，最接近正面微俯视机位。",
      "layout_slot": "单件白底图，不涉及编排",
      "layout_decision_basis": "该图为蓝白纹带杯碟咖啡杯单件白底图，只用于该单件结构与角度识别，不参与套装编排槽位判断。",
      "piece_count_check": "单件白底图，不涉及编排",
      "component_visibility": "该单件杯体、杯柄和杯碟均可见，杯碟后部被杯体自然遮挡，未见套装其他组成单件。",
      "naturally_visible_content": "适合展示该单件的杯体外形、杯口、杯柄、杯碟搭配关系和浅蓝白纹理。",
      "must_not_force_content": "不应强行展示套装整体件数、套装编排关系、杯底、杯碟底部、底款或不可见背面结构。",
      "suitable_page_tasks": "适合承担对应单件结构参考、单件颜色纹理确认和单件角度绑定任务。",
      "unsuitable_page_tasks": "不适合承担套装主图、套装件数核对或套装编排槽位判断任务。",
      "main_image_suitability": "不适合，因为该图只展示单件，不能表达 5 件套装整体。",
      "detail_image_suitability": "适合，因为可作为该组成单件的结构和角度参考。",
      "risk_notes": "无明显风险。",
      "recommended_task_binding": "建议绑定组件 1 的单件结构、颜色纹理和角度参考任务。",
      "admission_result": "合格，可进入对应机位与编排槽位",
      "merged_reference_note": "无"
    },
    {
      "layout_id": "layout_005",
      "image_index": 5,
      "file_name": "1S0A1898.JPG",
      "is_set_group": false,
      "overall_camera": "A",
      "camera_decision_basis": "单件从接近正面且略高的位置拍摄，可见杯口内侧、杯身正面、杯柄和杯碟上表面，最接近正面微俯视机位。",
      "layout_slot": "单件白底图，不涉及编排",
      "layout_decision_basis": "该图为浅青绿色浮雕纹杯碟组单件白底图，只用于该单件结构与角度识别，不参与套装编排槽位判断。",
      "piece_count_check": "单件白底图，不涉及编排",
      "component_visibility": "该单件杯体、杯柄和杯碟均可见，杯碟后部被杯体自然遮挡，未见套装其他组成单件。",
      "naturally_visible_content": "适合展示该单件的浅青绿色釉面、杯身纹理、杯柄形态、杯口和杯碟搭配关系。",
      "must_not_force_content": "不应强行展示套装整体件数、套装编排关系、底部结构、背面细节或真实尺寸信息。",
      "suitable_page_tasks": "适合承担对应单件结构参考、颜色纹理确认和单件角度绑定任务。",
      "unsuitable_page_tasks": "不适合承担套装主图、套装件数核对或套装编排槽位判断任务。",
      "main_image_suitability": "不适合，因为该图只展示单件，不能表达 5 件套装整体。",
      "detail_image_suitability": "适合，因为可作为该组成单件的结构和角度参考。",
      "risk_notes": "无明显风险。",
      "recommended_task_binding": "建议绑定组件 2 的单件结构、颜色纹理和角度参考任务。",
      "admission_result": "合格，可进入对应机位与编排槽位",
      "merged_reference_note": "无"
    },
    {
      "layout_id": "layout_006",
      "image_index": 6,
      "file_name": "1S0A1908.JPG",
      "is_set_group": false,
      "overall_camera": "A",
      "camera_decision_basis": "单件从接近正面且略高的位置拍摄，可见杯口内侧、杯身正面、杯柄和杯碟上表面，最接近正面微俯视机位。",
      "layout_slot": "单件白底图，不涉及编排",
      "layout_decision_basis": "该图为深青绿色浮雕纹陶瓷杯碟组合单件白底图，只用于该单件结构与角度识别，不参与套装编排槽位判断。",
      "piece_count_check": "单件白底图，不涉及编排",
      "component_visibility": "该单件杯体、杯柄和杯碟均可见，杯碟后部被杯体自然遮挡，未见套装其他组成单件。",
      "naturally_visible_content": "适合展示该单件的深青绿色釉面、杯身纹理、杯柄、杯口和杯碟搭配关系。",
      "must_not_force_content": "不应强行展示套装整体件数、套装编排关系、杯底、杯碟底部、底款或真实尺寸信息。",
      "suitable_page_tasks": "适合承担对应单件结构参考、颜色纹理确认和单件角度绑定任务。",
      "unsuitable_page_tasks": "不适合承担套装主图、套装件数核对或套装编排槽位判断任务。",
      "main_image_suitability": "不适合，因为该图只展示单件，不能表达 5 件套装整体。",
      "detail_image_suitability": "适合，因为可作为该组成单件的结构和角度参考。",
      "risk_notes": "无明显风险。",
      "recommended_task_binding": "建议绑定组件 3 的单件结构、颜色纹理和角度参考任务。",
      "admission_result": "合格，可进入对应机位与编排槽位",
      "merged_reference_note": "无"
    },
    {
      "layout_id": "layout_007",
      "image_index": 7,
      "file_name": "1S0A1913.JPG",
      "is_set_group": false,
      "overall_camera": "A",
      "camera_decision_basis": "单件从接近正面且略高的位置拍摄，可见杯口内侧、杯身正面、杯柄和杯碟上表面，最接近正面微俯视机位。",
      "layout_slot": "单件白底图，不涉及编排",
      "layout_decision_basis": "该图为深蓝黑釉咖啡杯与托碟单件白底图，只用于该单件结构与角度识别，不参与套装编排槽位判断。",
      "piece_count_check": "单件白底图，不涉及编排",
      "component_visibility": "该单件杯体、杯柄和杯碟均可见，杯碟后部被杯体自然遮挡，未见套装其他组成单件。",
      "naturally_visible_content": "适合展示该单件的深蓝黑釉面、杯身纹理、杯柄、杯口和杯碟搭配关系。",
      "must_not_force_content": "不应强行展示套装整体件数、套装编排关系、杯底、杯碟底部、底款或真实尺寸信息。",
      "suitable_page_tasks": "适合承担对应单件结构参考、颜色纹理确认和单件角度绑定任务。",
      "unsuitable_page_tasks": "不适合承担套装主图、套装件数核对或套装编排槽位判断任务。",
      "main_image_suitability": "不适合，因为该图只展示单件，不能表达 5 件套装整体。",
      "detail_image_suitability": "适合，因为可作为该组成单件的结构和角度参考。",
      "risk_notes": "无明显风险。",
      "recommended_task_binding": "建议绑定组件 4 的单件结构、颜色纹理和角度参考任务。",
      "admission_result": "合格，可进入对应机位与编排槽位",
      "merged_reference_note": "无"
    },
    {
      "layout_id": "layout_008",
      "image_index": 8,
      "file_name": "1S0A1921.JPG",
      "is_set_group": false,
      "overall_camera": "A",
      "camera_decision_basis": "单件从接近正面且略高的位置拍摄，可见杯口内侧、杯身正面、杯柄和杯碟上表面，最接近正面微俯视机位。",
      "layout_slot": "单件白底图，不涉及编排",
      "layout_decision_basis": "该图为深色釉面带杯碟咖啡杯单件白底图，只用于该单件结构与角度识别，不参与套装编排槽位判断。",
      "piece_count_check": "单件白底图，不涉及编排",
      "component_visibility": "该单件杯体、杯柄和杯碟均可见，杯碟后部被杯体自然遮挡，未见套装其他组成单件。",
      "naturally_visible_content": "适合展示该单件的深色釉面、橙褐色边缘、杯身纹理、杯柄、杯口和杯碟搭配关系。",
      "must_not_force_content": "不应强行展示套装整体件数、套装编排关系、杯底、杯碟底部、底款或真实尺寸信息。",
      "suitable_page_tasks": "适合承担对应单件结构参考、颜色纹理确认和单件角度绑定任务。",
      "unsuitable_page_tasks": "不适合承担套装主图、套装件数核对或套装编排槽位判断任务。",
      "main_image_suitability": "不适合，因为该图只展示单件，不能表达 5 件套装整体。",
      "detail_image_suitability": "适合，因为可作为该组成单件的结构和角度参考。",
      "risk_notes": "无明显风险。",
      "recommended_task_binding": "建议绑定组件 5 的单件结构、颜色纹理和角度参考任务。",
      "admission_result": "合格，可进入对应机位与编排槽位",
      "merged_reference_note": "无"
    }
  ],
  "notes": "本次只处理 set_angle_layout_inventory；未操作画布，未生成图片，未输出变量配置、最终提示词或质检结果。"
}
